[
  {
    "reviewId": "review-pilot-pending",
    "caseId": "institutional-sacrificial-escalation",
    "targetRef": "finding-pilot-attribution",
    "reviewer": "unassigned",
    "reviewerType": "human",
    "decision": "pending",
    "rationale": "Initial human adjudication has not yet occurred.",
    "date": "2026-08-05",
    "epistemicConcerns": [
      "source base is intentionally narrow",
      "institutional and spiritual hypotheses require substantial additional evidence"
    ]
  }
]
